commit	outcome_auroc	outcome_auprc	onset_mae_hrs	peak_vram_gb	status	description
2c60c2a	0.796848	0.364155	88.33	7.6	DISCARD	exp64: Direction D — skip Phase 3 (phase3_n_epochs=50→0); eval falls back to P2 best; vs exp63 baseline AUROC -0.036 (well past -0.01 Direction-D drop threshold → P3 IS net-positive on average) AUPRC -0.070 MAE +6.7 max_len 8.5→14.9 (+6.4pp regression); per-outcome HYPOGLY -0.121 BIGGEST HIT HYPERGLY -0.050 DEATH -0.049 KIDNEY -0.020 CARDIO +0.031 (only gain) RELEASE 0.694→0.688 (-0.006, target NOT recovered — exp62 NaN→P2 fallback's RELEASE=0.813 was a fluke not a signal); peak VRAM 7.6 GB; phase3 nan as designed; next: Direction A sub-1 — add ranking loss to P3 (mirror P2's curriculum so head stays in the loss landscape it converged into)
12ce6fe	0.829300	0.408678	82.88	8.4	DISCARD	exp65: Direction A sub-1 add pairwise ranking loss to Phase 3 mirroring P2 stage-1; λ_ranking calibrated 0.437581 from cap=0.2 × raw_out 0.607 / raw_rank 0.278 (P2-comparable magnitude); vs exp63 baseline AUROC -0.003 within noise AUPRC -0.025 MAE +1.29 max_len 8.5→12.6 (+4.1pp); per-outcome RELEASE 0.694→0.732 (+0.038 target weakness UP) CARDIO +0.027; DEATH -0.014 HYPERGLY -0.021 KIDNEY -0.018 HYPOGLY -0.031; phase3_epochs=11 BUT phase3_best_val=0.6685 at epoch 1 → METHODOLOGY BUG: lambda=0 during epoch 1 (calibration epoch), lambda=0.44 from epoch 2 → val_loss jumps 0.6685→0.7970 due to loss-function change not model regression → best-val selector picks epoch 1 → SAVED CHECKPOINT NEVER SAW RANKING GRADIENT; eval tested "exp63 + 1 BCE-only P3 epoch" not the intended joint-loss head; RELEASE +0.038 still arose from P3-shortening alone — direction validated but experiment must rerun with stable val criterion (val_outcome_raw not val_total)
82387ca	0.850015	0.451512	81.54	8.4	KEEP	exp66: Direction A sub-1 retry — add P3 pairwise ranking loss + early-stop on val_outcome_raw (stable across λ=0→λ_cal transition); λ_ranking calibrated 0.4172 from cap=0.2 × raw_out 0.636 / raw_rank 0.305 (P2-comparable scale); P3 ran 27 epochs early-stopped, raw_outcome 0.636→0.587 (-7.7%), raw_ranking 0.305→0.248 (-18.5% — Rule 2(a) bar effectively met for ranking, near for outcome), vl_select 0.655→0.630 at epoch 17 (saved best); vs exp63 baseline AUROC +0.017 (well past 0.005 noise) AUPRC +0.018 MAE 81.54 flat max_len 8.5→11.6 (+3.1pp small regression); per-outcome RELEASE 0.694→0.727 (+0.033 target weakness UP!) HYPOGLY +0.030 CARDIO +0.036 KIDNEY +0.017; DEATH -0.005 HYPERGLY -0.007 (both within noise); NEW BEST baseline; selector-bug in exp65 confirmed real — same code-change with stable val criterion = +0.017 AUROC instead of -0.003
d854e7d	0.819240	0.396634	90.01	8.4	DISCARD	exp67: Direction A sub-2 — replace P3 outcome BCE with ranking-only (gradient-free BCE for logging); P3 31 epochs early-stopped on val_ranking_raw; vs exp66 baseline AUROC -0.031 AUPRC -0.055 MAE +8.5 max_len 11.6→3.7 (-7.9pp gain due to backbone-1e-6 drift under different loss reshaping LM terminal emission); per-outcome RELEASE 0.727→0.594 (-0.133 COLLAPSE — BCE was calibrating the head for RELEASE that ranking-only cannot replicate, worse than exp64 no-P3 0.688) HYPOGLY -0.025 KIDNEY -0.017 CARDIO -0.011; HYPERGLY +0.013 (only outcome BCE was over-calibrating); DEATH flat; learning: outcome BCE in P3 IS net-positive specifically for RELEASE calibration, contradicts audit_0.2c P2-only signal — BCE plays different role in P3 (joint with ranking, natural dist) vs P2 (one of many aux, oversampled); Direction G (project-wide BCE removal) now less attractive — exp66 joint regime is the right P3 design; next: Direction A sub-3 oversampled DL in P3 (orthogonal lever)
260d0dc	0.801630	0.397303	81.39	7.0	DISCARD	exp68: Direction A sub-3 — oversampled DataLoader in Phase 3 (new TRAINING_SETTINGS flag phase3_oversample=True; finetune_transformer rebuilds train_dl with oversample=True from train_dl.dataset; api.py untouched); P3 early-stopped at 12 epochs (best at epoch 1, vl_select=0.666); vs exp66 baseline AUROC -0.048 AUPRC -0.055 MAE flat max_len 11.6→21.1 (+9.5pp regression); per-outcome HYPOGLY -0.133 (biggest hit — opposite of intended) HYPERGLY -0.045 RELEASE -0.046 KIDNEY -0.030 DEATH -0.015 CARDIO -0.003 — nearly all regress, no outcome benefits; hypothesis: BCE pos_weights are calibrated for natural dist; oversampling at patient level + pos_weight double-counts rare positives → head over-fits to specific positions and destroys broader-population calibration; natural distribution is the right loader for P3; Direction A space (sub-1 KEPT exp66, sub-2 DISCARD ranking-only, sub-3 DISCARD oversampled) now exhausted; next: Direction C soft-kernel BCE at LM head
ebe9618	0.870366	0.512191	82.61	9.4	KEEP	exp69: Direction C — soft-kernel LM-head BCE (learnable per-token log_tau_lm[V]; new get_temporal_soft_targets in utils.py uses scatter_add along V; init log(12/336) default + log(168/336) terminal; phase2_use_soft_kernel flag); FRESH P1 retrain (smoke deleted cache); P3 ran 50 epochs no early-stop on val_outcome_raw; vs exp66 baseline AUROC +0.020 (well past noise) AUPRC +0.060 (BIG — biggest single-exp gain since exp59 data-shape +0.10) MAE +1.1 flat max_len 11.6→0.0pp PERFECT termination (no fallback message in run.log → fallback_pids empty); per-outcome RELEASE 0.727→0.832 (+0.105 !!! biggest single-exp RELEASE jump ever) CARDIO 0.899→0.933 (+0.034) KIDNEY 0.802→0.844 (+0.042) HYPERGLY 0.836→0.852 (+0.016); DEATH 0.983→0.950 (-0.033) HYPOGLY 0.835→0.811 (-0.024) — small losses on the two outcomes most calibrated by the binary window already; log_tau_lm learned substantially — default 12h→7.5h median (tighter), terminals 168h→340h (DOUBLED — model wants even more pre-terminal signal than exp59 hand-picked); 291/346 tokens moved >22% from init; all Direction C guardrails CLEAR PASS by huge margins; NEW BEST baseline
HEAD~0	0.000000	0.000000	0.00	0.0	CRASH	exp70 attempt: Direction C extension to P1 BCE — add log_tau_emb Parameter[V] in EMREmbedding init log(3/336), phase1_use_soft_kernel flag, embedder.py routes to get_temporal_soft_targets with horizon=12h/336; SMOKE-LEVEL CRASH (sample=50, 1/2/1, fresh P1): Phase-1 ran but generated AR trajectories produced NaN timestamps → IntCastingNaNError in evaluation.py:148 pooled_episode_auc when np.floor.astype(int); 1 epoch of P1 with new kernel destabilises time2vec/time_head → NaN inference; per program.md Direction C "Risk. If the learned-kernel implementation is wrong it could break exp59's signal" — confirmed P1 is the riskier extension; reverted ALL embedder.py + model_config.py changes; not committed; diagnose.py P3-only-fallback fix kept as standalone bug-fix; next: pivot — Direction B contrastive OR investigate exp69 Δt regression
3da7a74	0.876445	0.494426	82.20	9.4	KEEP	exp71: drop P2 outcome BCE (phase2_scheduler.aux_fraction_caps["outcome"]=0.00); retest audit_0.2c on exp69 baseline; Rule 6 floor met by ranking; P3 outcome BCE unchanged (exp67 already proved load-bearing); fresh P1 retrain; vs exp69 baseline AUROC +0.006 (just past 0.005 noise) AUPRC -0.018 MAE -0.4 max_len 0% PERFECT preserved; per-outcome asymmetric DEATH +0.028 HYPERGLY +0.036 HYPOGLY +0.044 KIDNEY +0.006 RELEASE -0.001 BUT CARDIO 0.933→0.856 (-0.077) — P2 outcome BCE was specifically calibrating CARDIO via backbone shaping; soft-kernel LM head fully covers DEATH/HYPER/HYPOGLY/KIDNEY now but doesn't replace CARDIO BCE training; KEEP per Rule 5 AUROC primacy + simpler codebase (-1 loss term, -1 scheduler stage entry semantically); CARDIO regression flagged for later recovery experiment (per-outcome capping or alternative CARDIO-specific aux); P3 ran 50 epochs no early-stop; lambdas (post-train): ce=0.073 dt=0.198 outcome=0.000 ranking=0.024
740893b	0.859258	0.509793	84.44	9.5	DISCARD	exp72: Direction B reframed — SimCLR-style patient-contrastive aux on backbone hidden states (2 random non-pad positions/patient = pos pair, cross-patient = neg); new contrastive_proj head + patient_contrastive_loss + scheduler entry (cap 0.10 ramp 3); raw contrastive 3.31→3.0 (~7% drop only, FAILS Rule 2(a) 30% bar — barely learned); vs exp71 baseline AUROC -0.017 AUPRC +0.016 MAE +2.2 max_len 0.1pp; per-outcome RELEASE -0.048 HYPOGLY -0.061 BIGGEST HITS CARDIO -0.013 HYPERGLY -0.010 ; DEATH +0.010 KIDNEY +0.020; backbone-capacity diversion (exp58 failure mode) — contrastive absorbs gradient without producing useful representations; phase3 early-stopped 38 epochs; answers user open question — same-patient-position contrastive does NOT help on event sequences this size with this design (positions within same patient too similar to be hard negatives); next: try Direction C horizon-alignment fallback — wider log_tau_lm init for outcome-class tokens (recovers CARDIO from exp71's -0.077 regression)
3eaafa7	0.881711	0.483067	83.88	9.4	KEEP	exp73: three-tier log_tau_lm init aligned with downstream usage — default 12h, outcome-class 48h (matches outcome_horizon_hours), terminal 168h override; rest of pipeline unchanged from exp71; fresh P1; vs exp71 AUROC +0.006 (past 0.005 noise) AUPRC -0.011 MAE +1.7 max_len 0% PERFECT preserved; per-outcome CARDIO 0.856→0.906 (+0.050!! recovered from exp71 collapse, near exp69 0.933) KIDNEY +0.013 RELEASE -0.019 (small, within noise) HYPOGLY -0.006 DEATH -0.003 HYPERGLY -0.004; log_tau_lm learning: default 12h→7.6h median (similar to exp69), outcome p50 stayed at 48h init (model happy with horizon alignment), some outcomes pushed to 70-95h, terminals 330-353h (similar to exp69); P3 ran 50 epochs no early-stop; NEW BEST baseline; CARDIO recovery validates the horizon-alignment hypothesis — the soft kernel init was too narrow for clinical complications at the binary default
e81ad4e	0.862547	0.401532	83.19	9.4	DISCARD	exp74 hybrid: restore P2 outcome BCE cap=10 on top of exp73 three-tier log_tau_lm init (12h/48h/168h); fresh P1; vs exp73 baseline AUROC -0.019 AUPRC -0.081 (huge) MAE flat max_len 0.7pp; per-outcome CARDIO 0.906→0.842 (-0.064!) KIDNEY -0.028 HYPOGLY -0.021 HYPERGLY -0.015 DEATH +0.007 RELEASE +0.007 — opposite of intended (CARDIO regressed even with BCE restored, not improved); also worse than exp69 (0.870), exp71 (0.876), exp73 (0.882) — all 4 corners now tested; clean structural finding: outcome BCE and soft kernel provide REDUNDANT wide-window outcome supervision — when kernel is narrow (12h) BCE supplements usefully (exp69), when kernel is already wide (48h) BCE adds over-supervision that over-fits CARDIO/KIDNEY positives → REGRESSES the very outcomes it was meant to help; exp73 (no-BCE + 48h init) confirmed as the sweet spot of the four corners
c429d40	0.845945	0.439400	85.21	10.4	DISCARD	exp75: linear outcome head — replace 2-layer MLP (D→D ReLU+Dropout→K) with single Linear(D, K); num_params 6,404k→6,338k (-65k); fresh P1; vs exp73 baseline AUROC -0.036 AUPRC -0.044 MAE +1.3 max_len 0.4pp; per-outcome RELEASE 0.812→0.703 (-0.109!! catastrophic) HYPOGLY -0.054 HYPERGLY -0.027 KIDNEY -0.017 CARDIO -0.009 DEATH +0.002; linear head loses RELEASE-specific nonlinear pattern (stable-vitals AND no-complications AND few-treatments); confirms outcome-head capacity is bounded above AND below: exp24/exp50 showed wider/deeper hurts (curriculum delay); now exp75 shows narrower hurts (RELEASE encoding loss); 2-layer MLP D→D ReLU+Dropout→K is the right shape, kept locked
d6edf15	0.845327	0.391561	85.69	10.2	DISCARD	exp76: Δt magnitude loss on log1p(Δt_hours) instead of MSE on absolute time (P2 dt loss only; forward unchanged); fresh P1; vs exp73 baseline AUROC -0.037 AUPRC -0.091 MAE +1.8 max_len 0.9pp; per-outcome CARDIO 0.906→0.832 (-0.074) HYPERGLY -0.057 HYPOGLY -0.056 RELEASE -0.024 KIDNEY -0.013; DEATH +0.008; the log1p compression killed gradient on large-Δt positions → degraded AR trajectory generation across outcomes; structural finding: the Δt head's diag R²=-1.22 probe is MISLEADING — the L2-on-absolute-time loss is load-bearing despite the pred-mean bias; attempting to fix the "broken" probe via log1p reformulation makes things worse; current MSE-on-abs is the right loss for this distribution; Task A "lock" is the init scheme (Time2Vec log-spaced freqs), not the probe value; combined with exp75, two simplification attempts now confirm exp73's shape is at a sweet spot
